{
  "schema": "iv.aom/memory-record/v1",
  "memory_id": "mem-freddie-servicer-map-001",
  "scope": {
    "trust_zone": "internal_product",
    "agent_id": "freddie-product-hermes",
    "product_id": "product:freddie-sflld"
  },
  "type": "rationale",
  "statement": "Synthetic example: mapping decisions should be rechecked when the referenced source code set changes.",
  "authority": "non_canonical",
  "confidence": 0.82,
  "derived_from": [
    {
      "domain": "product",
      "id": "freddie-sflld-source-code-set",
      "version": "synthetic-v1",
      "digest": "sha256:dddddddddddddddddddddddddddddddddddddddddddddddddddddddddddddddd"
    },
    {
      "domain": "evidence",
      "id": "evidence-FREDDIE-184"
    }
  ],
  "validity": {
    "observed_at": "2026-09-03T14:04:00Z",
    "review_after": "2026-12-03T14:04:00Z",
    "staleness": "fresh"
  },
  "status": "active",
  "sensitivity": "confidential",
  "created_at": "2026-09-03T14:04:00Z",
  "producer": {"id": "agentmemory-adapter", "version": "0.1.0"}
}
